{"artifact_sha256":"b4340680f9d34d0cfb115877756c5994dbad9e16a83c106330705f250534fcc1","checks":[{"id":"input_coverage","label":"输入覆盖","message":"参考片和6条自有素材均完成真实探测、场景检测和代表帧抽样","score":2,"status":"pass"},{"id":"evidence_traceability","label":"证据可追溯","message":"关键镜头、匹配理由和主要提醒均带时间区间或代表帧","score":2,"status":"pass"},{"id":"source_matching","label":"参考-素材匹配","message":"7条参考镜头均有自有候选、桥接或明确原创改写，不把参考片放入成片候选","score":2,"status":"pass"},{"id":"production_readiness","label":"生产可用性","message":"已给出14维分镜表、素材区间、行业提醒、方向和待确认事项，可支撑方案与分镜","score":2,"status":"pass"},{"id":"execution_discipline","label":"执行完整性","message":"无付费调用；分析任务并行完成；编排事件可追踪；9个研究制品、代表帧和checkpoint一次性事务提交","score":2,"status":"pass"}],"created_at":"2026-08-20T04:25:58.793694+00:00","hard_failures":[],"input_hashes":{"breakdown":"bdb46993ca071216bb7c3fd6150f31ad608cd401f5328b52ba11296257911cf9","fingerprint":"ac55c4052bb20b08d38bef3e0232698b0faf1ea9354306c46a76c904f16e1e4b","matrix":"000f76a7aa322150667336ece3436398a65d6367fa5b45341bbebb5cb0babe50","synthesis":"49da21ce2278dc7856a6c2b31884fb639c68e4a675148e3a294da2ad4a974ba9"},"max_score":10,"producer":"research_scorecard@2.0","project_id":"table-mat-mix-v7","score":10,"semantic_sha256":"d918b7657abe61a7e8714c454191ff611d7d00ee3414972f6d063f341a87f13b","status":"pass","version":"1.0","warnings":["柔软回弹需要在工作台逐帧确认或改写为柔韧不变形","CTA需原创品牌文案和视觉，不复用参考品牌信息"]}